{
  "schema_type": "executed_order_writeback",
  "writeback_id": "ldd-executed-order-writeback-20260610-0849",
  "project": "tianma-work-os",
  "subproject": "llm-daredevil-desk",
  "review_time": "2026-06-10T08:49:00+08:00",
  "account": "longbridge_us_equity",
  "quote_type": "us_post_close_after_hours_broker_platform_sot",
  "source_of_truth": [
    "user_provided_longbridge_order_records_20260610_0848_0849_sgt",
    "user_provided_longbridge_post_sale_holdings_20260610_0848_0849_sgt"
  ],
  "orders": [
    {
      "symbol": "GLD",
      "direction": "sell",
      "quantity": 5,
      "displayed_price": 390.91,
      "estimated_gross_proceeds": 1954.55,
      "fill_status": "filled",
      "linked_rule_id": "gld-active-risk-rule-20260609-0828",
      "order_source": "longbridge_order_record_screenshot",
      "quote_type": "displayed_filled_order_price",
      "execution_review_status": "rule_compliant"
    },
    {
      "symbol": "GLD",
      "direction": "sell",
      "quantity": 5,
      "displayed_price": 391.05,
      "estimated_gross_proceeds": 1955.25,
      "fill_status": "filled",
      "linked_rule_id": "gld-active-risk-rule-20260609-0828",
      "order_source": "longbridge_order_record_screenshot",
      "quote_type": "displayed_filled_order_price",
      "execution_review_status": "rule_compliant"
    },
    {
      "symbol": "NVDA",
      "direction": "sell",
      "quantity": 5,
      "displayed_price": 201.74,
      "estimated_gross_proceeds": 1008.7,
      "fill_status": "filled",
      "linked_rule_id": "nvda-core-defense-rule-20260609-0828",
      "order_source": "longbridge_order_record_screenshot",
      "quote_type": "displayed_filled_order_price",
      "execution_review_status": "rule_compliant_price_outcome_separate"
    }
  ],
  "reconciliation": {
    "order_count": 3,
    "filled_order_count": 3,
    "estimated_gross_proceeds_usd": 4918.5,
    "GLD_position_before": 20,
    "GLD_position_after": 10,
    "NVDA_position_before": 20,
    "NVDA_position_after": 15,
    "visible_pending_orders_after_execution": 0,
    "visible_cancelled_orders_after_execution": 0,
    "reconciliation_status": "confirmed_against_post_sale_holdings_and_cash"
  },
  "related_records": [
    "records/ldd/2026-06-10/account_state_delta_0848_0849_sgt.json",
    "records/ldd/2026-06-10/gld_rule_execution_review_0848_0849_sgt.json",
    "records/ldd/2026-06-10/nvda_rule_execution_review_0848_0849_sgt.json"
  ]
}
